titulo,fuente,fecha_publicacion,url,es_paro_docente,hay_suspension_clases,ubicacion_bogota,ubicacion_Colombia,duracion_dias,organizaciones_sindicales,razones_paro,costo_mencionado,justificacion_paro,resumen,fecha_paro,tipo_movilizacion,ubicacion,descripcion,periodo_busqueda,fecha_extraccion,fuente_oficial
Paro docente a nivel nacional para pedir por una nueva ley de Financiamiento Educativo: cuándo es,MinutoUno,2025-11-03,https://www.minutouno.com/politica/paro-docente-nivel-nacional-pedir-una-nueva-ley-financiamiento-educativo-cuando-es-n6201386&ved=2ahUKEwicufbgqtuQAxWOJe8CHQRCJW0QxfQBegQIBxAC&usg=AOvVaw3gJDF-N8_tnW6tiC_B4Ygx,True,True,False,True,,[],Demandan una nueva ley de Financiamiento Educativo.,,"Se trata de un paro docente verdadero ya que se menciona que es una medida de fuerza que involucra a docentes de todo el país, lo que implica la suspensión de clases.",Paro docente a nivel nacional para exigir una nueva ley de Financiamiento Educativo.,2023-10-01,paro docente,Colombia,La medida de fuerza había sido anunciada a principios de octubre como el paso final de un plan de lucha que involucró a docentes de todo el país.,paro docente Colombia 2014,2025-11-05 15:33:43,Medio no especificado
14 de octubre – Paro nacional docente,UnTER,2025-11-04,https://www.unter.org.ar/2025/10/09/14-de-octubre-paro-nacional-docente/&ved=2ahUKEwicufbgqtuQAxWOJe8CHQRCJW0QxfQBegQIChAC&usg=AOvVaw0ivoiin8FH5AnrUPzhLfQ0,True,True,False,True,,[],Reclamo por una nueva Ley de Financiamiento Educativo.,,Se trata de un paro docente verdadero ya que hubo suspensión de clases programadas en todo el país.,El 14 de octubre se realizó un paro nacional docente en Colombia para exigir una nueva Ley de Financiamiento Educativo.,2023-10-14,paro docente,Colombia,El martes 14 de octubre lxs docentes de todo el país paramos para reclamar al gobierno de Javier Milei: Una nueva Ley de Financiamiento Educativo.,paro docente Colombia 2014,2025-11-05 15:33:43,No especificado
En Armenia se suspenden las clases por el paro de 48 horas de maestros,Caracol Radio,2025-11-05,https://caracol.com.co/2025/05/28/en-armenia-se-suspenden-las-clases-por-el-paro-de-48-horas-de-maestros/&ved=2ahUKEwicufbgqtuQAxWOJe8CHQRCJW0QxfQBegQIAxAC&usg=AOvVaw3h4yePbh6z2SWTIbO9bKmz,True,True,False,True,2.0,['FECODE'],Apoyo a la consulta popular y reformas del Gobierno Nacional.,,"Se suspendieron las clases en 29 instituciones educativas de Armenia debido a un paro de 48 horas convocado por Fecode, en el que participará el 100% de los docentes.",En Armenia se suspenden clases por un paro de 48 horas de maestros convocado por Fecode.,2025-05-28,paro docente,"Colombia, Armenia",Armenia. En las 29 instituciones educativas de la ciudad con sus 72 sedes no habrá clases los días 28 y 29 de mayo debido a la jornada de movilización...,paro docente Colombia 2014,2025-11-05 15:33:43,Secretaria de Educación de Armenia
"Por paro nacional, miércoles 28 y jueves 29 de mayo no habrá clases en colegios públicos de Armenia",Alcaldía de Armenia,2025-11-05,https://www.armenia.gov.co/atencion-al-ciudadano/noticias/por-paro-nacional-miercoles-28-y-jueves-29-de-mayo-no-habra-clases-en-colegios-publicos-de-armenia&ved=2ahUKEwicufbgqtuQAxWOJe8CHQRCJW0QxfQBegQIBRAC&usg=AOvVaw0E_5fR8iMvAiUB_9i82Tb7,True,True,False,True,2.0,[],Paro nacional que afecta a los colegios públicos.,,Se suspendieron las clases programadas en las instituciones educativas públicas de Armenia.,Se suspenden clases en colegios públicos de Armenia por paro nacional.,2024-05-28,paro docente,"Colombia, Armenia","La secretaria de Educación, Paula Andrea Huertas Arcila, informó que los días miércoles 28 y jueves 29 de mayo no habrá clases en las 29 instituciones...",paro docente Colombia 2014,2025-11-05 15:33:43,Secretaría de Educación
Paro nacional de Fecode este 30 de octubre: puntos y horarios de las marchas en Bogotá y otras ciudades de Colombia,La FM,2025-11-06,https://www.lafm.com.co/orden-publico/paro-nacional-de-fecode-horarios-y-rutas-de-las-marchas-del-30-de-octubre-en-bogota-381163&ved=2ahUKEwjF4MPjqtuQAxWyIkQIHfzIBiIQxfQBegQIARAC&usg=AOvVaw284cw40ea3rgBkn6DuuuOY,True,True,True,True,,['FECODE'],Demandas relacionadas con condiciones laborales y derechos de los docentes.,,Se trata de un paro docente verdadero ya que se menciona la participación de maestros en un paro programado con suspensión de clases.,Fecode convoca a un paro nacional el 30 de octubre con marchas en varias ciudades.,2023-10-30,paro docente,"Colombia, Bogotá","Este jueves 30 de octubre, maestros, maestras y directivos docentes adscritos a la Federación Colombiana de Educadores (Fecode) participarán en un paro...",paro maestros Bogotá 2014,2025-11-05 15:33:47,FECODE
Paro nacional de Fecode el 30 de octubre: ¿repondrán las clases el sábado?,Alerta Bogotá,2025-11-01,https://www.alertabogota.com/noticias/local/paro-nacional-de-fecode-el-30-de-octubre-repondran-las-clases-el-sabado&ved=2ahUKEwjF4MPjqtuQAxWyIkQIHfzIBiIQxfQBegQIBRAC&usg=AOvVaw19Qjx0OgGPtczkBtEf7SOl,True,True,True,True,,['FECODE'],Llamar la atención sobre los compromisos pendientes con el Gobierno nacional.,,Se trata de un paro docente verdadero ya que se menciona un paro nacional de Fecode con suspensión de clases programadas.,Fecode convoca a un paro nacional el 30 de octubre para exigir cumplimiento de compromisos gubernamentales.,2023-10-30,paro docente,"Colombia, nacional",El sindicato explicó que la movilización busca llamar la atención sobre los compromisos pendientes con el Gobierno nacional.,paro maestros Bogotá 2014,2025-11-05 15:33:47,FECODE
Fecode define detalles del paro nacional del magisterio el 30 de octubre,La FM,2025-11-01,https://www.lafm.com.co/actualidad/fecode-convoca-paro-nacional-docente-el-30-de-octubre-381056&ved=2ahUKEwjF4MPjqtuQAxWyIkQIHfzIBiIQxfQBegQIChAC&usg=AOvVaw3j8mSPq4Ouv0qpfuRJlhny,True,True,True,True,,['FECODE'],Exigir cumplimiento de acuerdos y defensa del sistema educativo y de salud.,,"Se trata de un paro nacional del magisterio, lo que implica la suspensión de clases programadas.",Fecode convoca a un paro nacional del magisterio el 30 de octubre para exigir derechos educativos.,2023-10-30,paro docente,"Colombia, nacional",La nueva manifestación de los maestros busca exigir cumplimiento de acuerdos y defensa del sistema educativo y de salud.,paro maestros Bogotá 2014,2025-11-05 15:33:47,FECODE
Paro de maestros en Bogotá: suspensión de clases por 24 horas en defensa de salud y trabajo digno,La FM,2025-11-03,https://www.lafm.com.co/actualidad/paro-de-maestros-en-bogota-clases-suspendidas-por-24-h-373430&ved=2ahUKEwjF4MPjqtuQAxWyIkQIHfzIBiIQxfQBegQIAhAC&usg=AOvVaw3i_DAc1GhvCy1E_rVaJHpX,True,True,True,False,1.0,[],Defensa de salud y trabajo digno.,,Se trata de un paro docente verdadero ya que hubo suspensión de clases programadas por 24 horas.,Paro de maestros en Bogotá con suspensión de clases por 24 horas.,2023-10-19,paro docente,"Colombia, Bogotá","Durante la jornada de este jueves, cientos de docentes se congregaron frente a la sede de la Fiduprevisora en Bogotá como parte del paro distrital de 24...",paro maestros Bogotá 2014,2025-11-05 15:33:47,Fiduprevisora
Maestros de Bogotá realizan paro de 24 horas «en defensa del derecho a la salud»,Radio Santa Fe 1070 a.m. Noticias de Colombia,2025-11-03,https://www.radiosantafe.com/2025/07/17/maestros-de-bogota-realizan-paro-de-24-horas-en-defensa-del-derecho-a-la-salud/&ved=2ahUKEwjF4MPjqtuQAxWyIkQIHfzIBiIQxfQBegQIBBAC&usg=AOvVaw0Fno7yirY-h5gQwMVHdg_y,True,True,True,True,1.0,[],Protesta por el mal servicio del modelo de salud.,,"Se trata de un paro de 24 horas con suspensión de clases programadas, en protesta por el mal servicio del modelo de salud.",Docentes de Bogotá realizan un paro de 24 horas en defensa del derecho a la salud.,2023-10-19,paro docente,"Colombia, Bogotá","–Un paro de 24 horas, enmarcado por marchas, realizan este jueves los docentes de Bogotá en protesta por el mal servicio del modelo de salud implementado...",paro maestros Bogotá 2014,2025-11-05 15:33:47,medio no especificado
Movilidad se complica en Chapinero por manifestación de profesores,Alerta Bogotá,2025-11-03,https://www.alertabogota.com/noticias/local/movilidad-se-complica-en-chapinero-por-manifestacion-de-profesores&ved=2ahUKEwjF4MPjqtuQAxWyIkQIHfzIBiIQxfQBegQICRAC&usg=AOvVaw1MZKiuTtPGNG3CklRRza5R,True,True,True,False,,[],Demandas relacionadas con la movilidad y condiciones laborales de los docentes.,,Se trata de un paro docente verdadero ya que se menciona que las manifestaciones son parte de un Paro Distrital convocado por los maestros.,Los profesores realizan una manifestación en Chapinero como parte de un Paro Distrital.,2023-10-03,paro docente,"Colombia, Bogotá, Chapinero",Estas manifestaciones hacen parte del Paro Distrital convocado por los maestros.,paro maestros Bogotá 2014,2025-11-05 15:33:47,noticia no especificada
Paro nacional de Fecode este 30 de octubre: puntos y horarios de las marchas en Bogotá y otras ciudades de Colombia,La FM,2025-11-06,https://www.lafm.com.co/orden-publico/paro-nacional-de-fecode-horarios-y-rutas-de-las-marchas-del-30-de-octubre-en-bogota-381163&ved=2ahUKEwiHps_lqtuQAxVeH0QIHb85BtYQxfQBegQICRAC&usg=AOvVaw2zU3XpKOK8fUeqovb94Wqv,True,True,True,True,,['FECODE'],Demandas relacionadas con condiciones laborales y derechos de los docentes.,,Se trata de un paro docente verdadero ya que se menciona la participación de maestros en un paro programado con suspensión de clases.,Fecode convoca a un paro nacional el 30 de octubre con marchas en varias ciudades.,2023-10-30,paro docente,"Colombia, Bogotá","Este jueves 30 de octubre, maestros, maestras y directivos docentes adscritos a la Federación Colombiana de Educadores (Fecode) participarán en un paro...",FECODE paro 2014,2025-11-05 15:33:50,FECODE
Fecode define detalles del paro nacional del magisterio el 30 de octubre,La FM,2025-11-01,https://www.lafm.com.co/actualidad/fecode-convoca-paro-nacional-docente-el-30-de-octubre-381056&ved=2ahUKEwiHps_lqtuQAxVeH0QIHb85BtYQxfQBegQIChAC&usg=AOvVaw1qZPsZOTLwagRJSP8yQLT_,True,True,False,True,,['FECODE'],Exigir cumplimiento de acuerdos y defensa del sistema educativo y de salud.,,"Se trata de un paro nacional del magisterio, lo que implica la suspensión de clases programadas.",Fecode convoca a un paro nacional del magisterio para el 30 de octubre.,2023-10-30,paro docente,Colombia,La nueva manifestación de los maestros busca exigir cumplimiento de acuerdos y defensa del sistema educativo y de salud.,FECODE paro 2014,2025-11-05 15:33:50,FECODE
"""El paro podría crecer hasta ser de todo el sector público"" : López -",Crónica del Quindio,2025-11-06,https://archivo.cronicadelquindio.com/noticias/region/el-paro-podra-crecer-hasta-ser-de-todo-el-sector-pblico-lpez&ved=2ahUKEwiHps_lqtuQAxVeH0QIHb85BtYQxfQBegQICBAC&usg=AOvVaw0dVaURgvcYJAPOZBOxDlzq,True,True,True,True,3.0,[],Demandas del sector educativo que podrían extenderse al sector público.,,"Se trata de un paro docente verdadero ya que se menciona que se cumple desde hace tres días, lo que implica suspensión de clases.",El Paro Nacional de Educadores en Colombia se lleva a cabo desde hace tres días y podría extenderse al sector público.,2023-10-20,paro docente,"Colombia, nacional","El Paro Nacional de Educadores, que se cumple desde hace tres días en Colombia, podría crecer hasta convertirse en un paro del sector público,...",FECODE paro 2014,2025-11-05 15:33:50,Medio no especificado
Noticia Ibagué: Docentes anuncian paro de 48 horas el próximo lunes,Alerta Tolima,2025-11-02,https://www.alertatolima.com/noticias/tolima/ibague/paro-de-docentes-sera-de-48-horas-partir-del-proximo-lunes-en-ibague&ved=2ahUKEwjz8_3mqtuQAxXrI0QIHcpDJFAQxfQBegQIBRAC&usg=AOvVaw2LLveu_BsovMiNJrVPd0xC,True,True,False,True,2.0,[],Incumplimientos por parte de la administración educativa.,,Se trata de un paro docente verdadero ya que se anuncia un cese de actividades por 48 horas.,Docentes de Ibagué anuncian un paro de 48 horas por incumplimientos administrativos.,2023-10-30,paro docente,"Colombia, Ibagué","El secretario de Educación dialogó con los maestros para evitar el cese de actividades, sin embargo, ellos exponen varios incumplimiento.",huelga de profesores Colombia 2014,2025-11-05 15:33:54,Noticia Ibagué
Docentes en Cali se unen a Paro Nacional de Maestros,Noticiero 90 Minutos,2048-11-05,https://90minutos.co/colombia/docentes-en-cali-se-unen-a-paro-nacional-de-maestros/&ved=2ahUKEwiordvsqtuQAxUxJ0QIHa_UNiAQxfQBegQIBxAC&usg=AOvVaw0cSDdY0Aq4f9-b3dFKYiNt,True,True,False,True,,[],Demandas relacionadas con mejoras salariales y condiciones laborales.,,Se trata de un paro docente verdadero ya que hubo suspensión de clases programadas en Cali para unirse al Paro Nacional de Maestros.,Docentes de Cali suspenden clases para unirse al Paro Nacional de Maestros.,2023-10-01,paro docente,"Colombia, Cali",Los docentes de los colegios públicos en Cali suspendieron las clases para unirse al Paro Nacional de Maestros junto a otros 300 mil docentes de todo el...,magisterio colombiano paro 2014,2025-11-05 15:34:06,Medio oficial no especificado
"14 de octubre, paro nacional y movilización docente",El Sureño,2025-11-03,https://www.surenio.com.ar/14-de-octubre-paro-nacional-y-movilizacion-docente/&ved=2ahUKEwjBt8DuqtuQAxXFPkQIHSflNrMQxfQBegQIBBAC&usg=AOvVaw2KE-90GCpZkcfnL6-S3ESp,True,True,False,True,2.0,['Confederación de Trabajadores de la Educación'],Adhesión al paro nacional docente y demandas relacionadas con la educación.,,Se trata de un paro docente verdadero ya que se menciona una jornada de paro de 48 horas con suspensión de clases.,El 14 de octubre inicia un paro nacional docente de 48 horas.,2023-10-14,paro docente,Colombia,Este martes 14/10 primera jornada del paro de 48 hs. con adhesión al paro nacional docente convocado por la Confederación de Trabajadores de la Educación de...,ministerio educación paro maestros 2014,2025-11-05 15:34:10,Confederación de Trabajadores de la Educación
Esta es la situación jurídica de los maestros que están en paro laboral,Soy502,2025-11-03,https://www.soy502.com/articulo/situacion-juridica-maestros-estan-paro-laboral-101772&ved=2ahUKEwjBt8DuqtuQAxXFPkQIHSflNrMQxfQBegQIAhAC&usg=AOvVaw3utkF7aDvWD8o9l9ta_D5y,True,True,False,True,,[],Negociación de un pacto colectivo.,,"Se menciona que los maestros están en paro laboral, lo que implica suspensión de clases.",Los maestros están en paro laboral debido a negociaciones de un pacto colectivo.,2023-10-01,paro docente,Colombia,"Maestros y autoridades del Ejecutivo se han enfrentado en escenarios judiciales, debido a un pacto colectivo en negociación.OTRAS NOTICIAS: Altercado entre...",ministerio educación paro maestros 2014,2025-11-05 15:34:10,noticia no especificada
SUTEP reprograma paro nacional para el 14 de mayo,Radio Onda Azul,2025-11-06,https://radioondaazul.com/sutep-reprograma-paro-nacional-para-el-14-de-mayo/&ved=2ahUKEwjBt8DuqtuQAxXFPkQIHSflNrMQxfQBegQIAxAC&usg=AOvVaw34tlozel2XnGlriQH8UyXk,True,True,False,True,,['SUTEP'],Derechos laborales y mayor inversión educativa.,,"Se trata de un paro nacional programado por gremios docentes, lo que implica la suspensión de clases.","El SUTEP ha reprogramado un paro nacional para el 14 de mayo, exigiendo derechos laborales y más inversión en educación.",2024-05-14,paro docente,Colombia,Gremios docentes se movilizan por derechos laborales y mayor inversión educativa.,ministerio educación paro maestros 2014,2025-11-05 15:34:10,SUTEP
Paro de trabajadores de la educación: vigilantes impedirán entrada a colegios y universidades,Red+ Noticias,2025-11-17,https://redmas.com.co/colombia/Paro-de-trabajadores-de-la-educacion-vigilantes-impediran-entrada-a-colegios-y-universidades-20240514-0050.html&ved=2ahUKEwjBt8DuqtuQAxXFPkQIHSflNrMQxfQBegQICRAC&usg=AOvVaw3nR7_4z1UwEBHnK_uME1P7,True,True,False,True,,[],Demandan mejoras en las condiciones laborales y la defensa de los derechos de los trabajadores de la educación.,,Se trata de un paro indefinido que implica la suspensión de clases programadas en colegios y universidades.,Los trabajadores de la educación inician un paro indefinido que afectará la entrada a colegios y universidades.,2023-10-05,paro docente,Colombia,Trabajadores del sector educativo entrarán a paro indefinido y explican los alcances que esta jornada tendrá en estudiantes y docentes.,ministerio educación paro maestros 2014,2025-11-05 15:34:10,Medio de comunicación no especificado
Paro docente a nivel nacional para pedir por una nueva ley de Financiamiento Educativo: cuándo es,MinutoUno,2025-11-03,https://www.minutouno.com/politica/paro-docente-nivel-nacional-pedir-una-nueva-ley-financiamiento-educativo-cuando-es-n6201386&ved=2ahUKEwjPosDwqtuQAxUoE0QIHYRbDmQQxfQBegQIBBAC&usg=AOvVaw1I_fFvAuVo16c5TSgmTM88,True,True,False,True,,[],Demandan una nueva ley de Financiamiento Educativo.,,"Se trata de un paro docente verdadero ya que se menciona que es una medida de fuerza a nivel nacional que involucra a docentes de todo el país, lo que implica suspensión de clases.",Paro docente a nivel nacional para exigir una nueva ley de Financiamiento Educativo.,2023-10-01,paro docente,Colombia,La medida de fuerza había sido anunciada a principios de octubre como el paso final de un plan de lucha que involucró a docentes de todo el país.,paro educativo nacional Colombia 2014,2025-11-05 15:34:15,Medio no especificado
14 de octubre – Paro nacional docente,UnTER,2025-11-04,https://www.unter.org.ar/2025/10/09/14-de-octubre-paro-nacional-docente/&ved=2ahUKEwjPosDwqtuQAxUoE0QIHYRbDmQQxfQBegQIChAC&usg=AOvVaw1hsIcwjgkEJAW_0KFMH2VN,True,True,False,True,,[],Reclamo por una nueva Ley de Financiamiento Educativo.,,Se trata de un paro docente verdadero ya que hubo suspensión de clases programadas en todo el país.,El 14 de octubre se realizó un paro nacional docente en protesta por la falta de financiamiento educativo.,2023-10-14,paro docente,"Colombia, nacional",El martes 14 de octubre lxs docentes de todo el país paramos para reclamar al gobierno de Javier Milei: Una nueva Ley de Financiamiento Educativo.,paro educativo nacional Colombia 2014,2025-11-05 15:34:15,No especificado
Ctera anunció paro nacional docente para el 14 de octubre y jornada de protesta este miércoles,RufinoWeb,2025-11-01,https://rufinoweb.com.ar/ctera-anuncio-paro-nacional-docente-para-el-14-de-octubre-y-jornada-de-protesta-este-miercoles/&ved=2ahUKEwjPosDwqtuQAxUoE0QIHYRbDmQQxfQBegQIBhAC&usg=AOvVaw0DtIJm7HJaNdSWINjGr-Ep,True,True,False,True,,['Ctera'],"Reclaman por la restitución del Fonid, paritarias nacionales y mejores salarios.",,"Se trata de un paro nacional docente anunciado por Ctera, lo que implica la suspensión de clases programadas.","Ctera anunció un paro nacional docente para el 14 de octubre, con una jornada de protesta previa.",2023-10-14,paro docente,Colombia,"Sadop acompañará sin suspensión de clases. Reclaman por la restitución del Fonid, paritarias nacionales y mejores salarios. Publicado. 4 semanas atrás.",paro educativo nacional Colombia 2014,2025-11-05 15:34:15,Ctera
Paro nacional de maestros afectará colegios del Caribe este jueves 30,Alerta Caribe,2025-11-01,https://www.alertacaribe.com/noticias/programese-paro-nacional-de-maestros-afectara-varias-ciudades-de-la-costa-caribe-este-jueves-30-de-octubre&ved=2ahUKEwj57c3yqtuQAxUXEEQIHf_HEhsQxfQBegQIBhAC&usg=AOvVaw2h7EfrbKDOUVgSjOSi9_Ek,True,True,False,True,,[],Demandas relacionadas con mejoras en las condiciones laborales y salariales de los docentes.,,Se trata de un paro nacional de maestros que afectará la programación de clases en colegios de la Costa Caribe.,Paro nacional de maestros afectará clases en la Costa Caribe.,2023-10-30,paro docente,"Colombia, Costa Caribe","Más de 350.000 docentes se unirán al paro nacional de este jueves, afectando clases en colegios de toda la Costa Caribe.",suspensión de clases por paro docente 2014,2025-11-05 15:34:19,noticia no especificada
Ctera anunció paro nacional docente para el 14 de octubre y jornada de protesta este miércoles,RufinoWeb,2025-11-01,https://rufinoweb.com.ar/ctera-anuncio-paro-nacional-docente-para-el-14-de-octubre-y-jornada-de-protesta-este-miercoles/&ved=2ahUKEwj57c3yqtuQAxUXEEQIHf_HEhsQxfQBegQIBBAC&usg=AOvVaw02H6ZVBPMTU1UqCSxatKYr,True,True,False,True,,"['Ctera', 'Sadop']","Reclaman por la restitución del Fonid, paritarias nacionales y mejores salarios.",,"Se trata de un paro nacional docente programado para el 14 de octubre, lo que implica la suspensión de clases.","Ctera anunció un paro nacional docente para el 14 de octubre, con reclamos por mejores condiciones laborales.",2023-10-14,paro docente,"Argentina, nacional","Sadop acompañará sin suspensión de clases. Reclaman por la restitución del Fonid, paritarias nacionales y mejores salarios. Publicado. 4 semanas atrás.",suspensión de clases por paro docente 2014,2025-11-05 15:34:19,Ctera
Suspenden clases presenciales en colegios de Soacha por paro de conductores,Alerta Bogotá,2025-11-01,https://www.alertabogota.com/noticias/local/suspenden-clases-presenciales-en-colegios-de-soacha-por-paro-de-conductores&ved=2ahUKEwj57c3yqtuQAxUXEEQIHf_HEhsQxfQBegQICRAC&usg=AOvVaw3FDv1LtXfNtvN8a17FvQil,True,True,False,True,,[],Paro de conductores que afecta el transporte escolar.,,"Se suspendieron las clases presenciales en colegios de Soacha debido a un paro de conductores, lo que implica una suspensión de actividades educativas.",Se suspendieron clases en Soacha por un paro de conductores.,2023-10-03,paro docente,"Colombia, Soacha","La administración explicó que la decisión se tomó con el fin de proteger a estudiantes, docentes y directivos docentes.",suspensión de clases por paro docente 2014,2025-11-05 15:34:19,Administración local de Soacha
Mineduc define ruta para recuperar tiempo perdido en escuelas tras huelga docente,Soy502,2025-11-03,https://www.soy502.com/articulo/mineduc-estrategia-recuperacion-tras-huelga-docente-102052&ved=2ahUKEwj57c3yqtuQAxUXEEQIHf_HEhsQxfQBegQIARAC&usg=AOvVaw1Ktl9rkN2M3AUgYrdMwFCj,True,True,False,True,,['STEG'],Recuperar el tiempo perdido en las escuelas debido a la huelga.,,Se trata de un paro docente verdadero ya que se menciona una huelga magisterial que ha causado la suspensión de clases.,Se define una ruta para recuperar el tiempo perdido en escuelas tras una huelga docente.,2023-10-01,huelga,Colombia,Tutores apoyados por voluntarios serán los encargados de enseñar los contenidos atrasados por la huelga magisterial.OTRAS NOTAS: CC ordena al STEG suspender...,suspensión de clases por paro docente 2014,2025-11-05 15:34:19,Mineduc
Las protestas de los maestros y la calidad de la educación ...,Google (SerpAPI),2014-05-20,https://www.colectivodeabogados.org/las-protestas-de-los-maestros-y-la-calidad-de-la-educacion-en-colombia/,True,True,False,True,3.0,['FECODE'],"Demandas por mejores salarios, condiciones laborales y atención a los problemas del magisterio.",,"Se realizó un paro nacional de 3 días por parte del magisterio, lo que implica la suspensión de clases programadas.",El magisterio colombiano realizó un paro nacional de 3 días debido a la desatención de sus problemas laborales.,2014-05-13,paro docente,Colombia,"El magisterio, representado por FECODE, la semana pasada realizó un paro nacional de 3 días con el objetivo de presionar al Gobierno y denunciar la ...",(paro docente OR paro maestros OR huelga profesores OR FECODE OR ADE) Colombia 2014,2025-11-05 15:34:25,CAJAR
"Adriana Tono, fuera de tono",Google (SerpAPI),2014-05-16,https://www.las2orillas.co/adriana-tono-fuera-de-tono-y-un-cm-que-perdio-la-letra/,True,True,False,True,,['FECODE'],Mejorar las condiciones de la educación y el reconocimiento del trabajo docente.,,"Se trata de un paro docente verdadero ya que se menciona un paro nacional indefinido de maestros que comenzó el 14 de mayo de 2014, lo que implica la suspensión de clases.","El 14 de mayo de 2014 comenzó un paro nacional indefinido de docentes en Colombia, liderado por FECODE, para exigir mejoras en el sistema educativo.",2014-05-14,paro docente,Colombia,... paro indefinido de docentes que se inició formalmente hoy 14 de mayo de 2014. La Federación Colombiana de Educadores (FECODE) es una organización que ...,(paro docente OR paro maestros OR huelga profesores OR FECODE OR ADE) Colombia 2014,2025-11-05 15:34:33,Las2orillas
gabriel eduardo mendoza martelo,Google (SerpAPI),,https://www.corteconstitucional.gov.co/relatoria/2014/t-541-14.htm,True,True,True,False,2.0,[],Los docentes se oponen al cierre de cursos y a la sustracción de carga académica.,,"Se considera un paro docente verdadero porque se menciona una 'desobediencia civil' programada para el 1° y 2 de octubre, lo que implica la suspensión de clases.",Docentes del Colegio Los Alpes I.E.D. en Bogotá realizarán un paro los días 1 y 2 de octubre en protesta por el cierre de cursos.,2013-10-01,paro docente,"Colombia, Bogotá, Colegio Los Alpes I.E.D.","- Escrito de la Dirección Local de Educación de San Cristóbal, órgano adscrito a la Secretaría de Educación de Bogotá, radicado el 7 de julio de 2014, con sus ...",(paro educativo OR suspensión clases) Bogotá 2014,2025-11-05 15:35:00,Corte Constitucional
